<?xml version="1.0" encoding="UTF-8"?>

<!ELEMENT cats (cat+)>
<!ELEMENT cat (name, age, breed)>
<!ELEMENT name (#PCDATA)>
<!ELEMENT age (#PCDATA)>
<!ELEMENT breed (#PCDATA)>

<!ATTLIST cat id ID #REQUIRED>